{
  "schema_version": "1.0",
  "session_id": "20260404-183045-a1b2c3",
  "timestamp_start": "2026-04-04T18:30:45Z",
  "timestamp_end": "2026-04-04T18:32:12Z",
  "source_device": "epson-ds-1630",
  "input_method": "adf",
  "duplex": true,
  "resolution_dpi": 600,
  "color_mode": "color",
  "page_count": 4,
  "pages": [
    {
      "filename": "page_001.tiff",
      "side": "front",
      "size_bytes": 25431876,
      "dimensions": {"width_px": 5100, "height_px": 6600}
    },
    {
      "filename": "page_002.tiff",
      "side": "back",
      "size_bytes": 25102344,
      "dimensions": {"width_px": 5100, "height_px": 6600}
    },
    {
      "filename": "page_003.tiff",
      "side": "front",
      "size_bytes": 24987654,
      "dimensions": {"width_px": 5100, "height_px": 6600}
    },
    {
      "filename": "page_004.tiff",
      "side": "back",
      "size_bytes": 25234567,
      "dimensions": {"width_px": 5100, "height_px": 6600}
    }
  ],
  "output_path": "/volume1/incoming/scans/sessions/20260404-183045-a1b2c3/",
  "user_tags": [],
  "notes": ""
}
